{
  "$schema": "https://json-schema.org/draft/2020-12/schema",
  "title": "ltp-inspect contract v1.0",
  "type": "object",
  "x-canonRefs": [
    "LTP-REQ-ORIENT-IDENTITY-1",
    "LTP-REQ-ORIENT-DRIFT-1",
    "LTP-REQ-ORIENT-ADMISSIBLE-FUTURES-1",
    "LTP-REQ-NONGOAL-NO-DECISION-1",
    "LTP-REQ-NONGOAL-NO-MODEL-EXEC-1",
    "LTP-REQ-NONGOAL-NO-HEURISTIC-ADAPT-1",
    "LTP-REQ-TRACE-JSONL-1",
    "LTP-REQ-TRACE-VERSION-1",
    "LTP-REQ-NONGOAL-NO-DECISION-1",
    "LTP-REQ-NONGOAL-NO-MODEL-EXEC-1",
    "LTP-REQ-NONGOAL-NO-HEURISTIC-ADAPT-1",
    "LTP-REQ-NONGOAL-TRACE-NOT-MEMORY-1"
  ],
  "$comment": "Canon refs: LTP-REQ-ORIENT-IDENTITY-1, LTP-REQ-ORIENT-DRIFT-1, LTP-REQ-ORIENT-ADMISSIBLE-FUTURES-1, LTP-REQ-TRACE-JSONL-1, LTP-REQ-TRACE-VERSION-1, LTP-REQ-NONGOAL-NO-DECISION-1, LTP-REQ-NONGOAL-NO-MODEL-EXEC-1, LTP-REQ-NONGOAL-NO-HEURISTIC-ADAPT-1, LTP-REQ-NONGOAL-TRACE-NOT-MEMORY-1. This schema is intentionally extensible; unknown fields are allowed, but required fields are normative.",
  "additionalProperties": true,
  "required": [
    "contract",
    "generated_at",
    "tool",
    "input",
    "orientation",
    "continuity",
    "futures",
    "branches",
    "notes"
  ],
  "properties": {
    "contract": {
      "type": "object",
      "additionalProperties": false,
      "required": ["name", "version", "schema"],
      "properties": {
        "name": {
          "type": "string",
          "const": "ltp-inspect"
        },
        "version": {
          "type": "string",
          "const": "1.0"
        },
        "schema": {
          "type": "string",
          "const": "docs/contracts/ltp-inspect.v1.schema.json"
        }
      }
    },
    "compliance": {
      "type": "object",
      "required": [
        "trace_integrity",
        "identity_binding",
        "identity_authentication",
        "replay_determinism"
      ],
      "properties": {
        "trace_integrity": {
          "enum": [
            "verified",
            "broken",
            "unchecked"
          ]
        },
        "identity_binding": {
          "enum": [
            "ok",
            "violated",
            "unchecked"
          ],
          "description": "Consistency of declared identities/tokens only, not authentication."
        },
        "identity_authentication": {
          "const": "unchecked"
        },
        "replay_determinism": {
          "enum": [
            "ok",
            "failed",
            "unchecked"
          ],
          "description": "The current inspector reports unchecked; no execution reducer is run."
        },
        "signatures": {
          "type": "object",
          "required": [
            "present",
            "valid",
            "verification"
          ],
          "properties": {
            "present": {
              "type": "boolean"
            },
            "valid": {
              "type": [
                "boolean",
                "null"
              ]
            },
            "verification": {
              "enum": [
                "unchecked",
                "absent"
              ]
            }
          }
        }
      }
    },
    "audit_summary": {
      "type": "object",
      "required": [
        "verdict",
        "regulator_ready",
        "unchecked_checks"
      ],
      "properties": {
        "verdict": {
          "enum": [
            "PASS",
            "FAIL",
            "INCOMPLETE"
          ]
        },
        "regulator_ready": {
          "const": false
        },
        "unchecked_checks": {
          "type": "array",
          "items": {
            "type": "string"
          }
        }
      }
    },
    "generated_at": {
      "type": "string",
      "format": "date-time"
    },
    "tool": {
      "type": "object",
      "additionalProperties": false,
      "required": ["name", "build"],
      "properties": {
        "name": {
          "type": "string",
          "const": "ltp:inspect"
        },
        "build": {
          "type": "string"
        }
      }
    },
    "input": {
      "type": "object",
      "additionalProperties": false,
      "required": ["source", "frames", "format"],
      "properties": {
        "type": { "enum": ["raw", "audit_log"] },
        "hash_root": { "type": "string" },
        "source": {
          "type": "string",
          "enum": ["stdin", "file"]
        },
        "path": {
          "type": "string",
          "minLength": 1
        },
        "frames": {
          "type": "integer",
          "minimum": 0
        },
        "format": {
          "type": "string",
          "enum": ["jsonl", "json"]
        }
      }
    },
    "orientation": {
      "type": "object",
      "additionalProperties": false,
      "required": ["stable", "drift_level", "identity", "drift_history"],
      "properties": {
        "stable": {
          "type": "boolean"
        },
        "identity": {
          "type": "string",
          "minLength": 1
        },
        "drift_level": {
          "type": "string",
          "enum": ["low", "medium", "high", "unknown"]
        },
        "focus_momentum": {
          "type": "number"
        },
        "drift_history": {
          "type": "array",
          "items": {
            "type": "object",
            "additionalProperties": false,
            "required": ["value"],
            "properties": {
              "id": {
                "type": "string"
              },
              "ts": {
                "type": ["string", "number"]
              },
              "value": {
                "type": ["number", "string"]
              },
              "note": {
                "type": "string"
              }
            }
          }
        }
      }
    },
    "continuity": {
      "type": "object",
      "additionalProperties": false,
      "required": ["preserved", "notes"],
      "properties": {
        "preserved": {
          "type": "boolean"
        },
        "notes": {
          "type": "array",
          "items": {
            "type": "string"
          }
        },
        "token": {
          "type": "string"
        }
      }
    },
    "futures": {
      "type": "object",
      "additionalProperties": false,
      "required": ["admissible", "degraded", "blocked"],
      "properties": {
        "admissible": {
          "type": "array",
          "items": { "$ref": "#/$defs/branch" }
        },
        "degraded": {
          "type": "array",
          "items": { "$ref": "#/$defs/branch" }
        },
        "blocked": {
          "type": "array",
          "items": { "$ref": "#/$defs/branch" }
        }
      }
    },
    "branches": {
      "type": "array",
      "items": { "$ref": "#/$defs/branch" }
    },
    "notes": {
      "type": "array",
      "items": {
        "type": "string"
      }
    }
  },
  "$defs": {
    "branch": {
      "type": "object",
      "additionalProperties": false,
      "required": ["id", "status"],
      "properties": {
        "id": {
          "type": "string"
        },
        "status": {
          "type": "string"
        },
        "confidence": {
          "type": "number"
        },
        "path": {
          "type": "string"
        },
        "class": {
          "type": "string"
        },
        "reason": {
          "type": "string"
        },
        "constraints": {
          "type": "array",
          "items": {
            "type": "string"
          }
        }
      }
    }
  }
}
