{
  "contract": {
    "name": "ltp-inspect",
    "version": "1.0",
    "schema": "docs/contracts/ltp-inspect.v1.schema.json"
  },
  "generated_at": "2025-12-23T18:59:15.595Z",
  "tool": {
    "name": "ltp:inspect",
    "build": "dev"
  },
  "input": {
    "source": "file",
    "path": "/app/test_exports/trace.json",
    "frames": 1,
    "format": "json",
    "type": "raw"
  },
  "orientation": {
    "identity": "unknown",
    "stable": false,
    "drift_level": "unknown",
    "drift_history": []
  },
  "continuity": {
    "preserved": true,
    "notes": []
  },
  "branches": [],
  "futures": {
    "admissible": [],
    "degraded": [],
    "blocked": []
  },
  "notes": [
    "no orientation frame observed",
    "no drift snapshots observed (focus_snapshot missing)",
    "no route_response frame observed"
  ]
}