{"contract":{"name":"ltp-inspect","version":"1.0","schema":"docs/contracts/ltp-inspect.v1.schema.json"},"generated_at":"2024-01-01T00:00:00.000Z","tool":{"name":"ltp:inspect","build":"dev"},"input":{"source":"file","path":"tools/ltp-inspect/fixtures/minimal.audit.trace.jsonl","frames":3,"format":"jsonl","type":"audit_log","hash_root":"c7014cdcca624caa1965c0a16c3cceb1f033b99a0bd061608807ab28c5107d32"},"orientation":{"identity":"ct-1","stable":true,"drift_level":"medium","drift_history":[{"id":"t1","value":0.55}]},"continuity":{"preserved":true,"notes":[],"token":"ct-1"},"branches":[{"id":"A","confidence":0.62,"status":"admissible"}],"futures":{"admissible":[{"id":"A","confidence":0.62,"status":"admissible"}],"degraded":[],"blocked":[]},"notes":["retry updated drift"],"compliance":{"profile":"fintech","trace_integrity":"verified","identity_binding":"ok","identity_authentication":"unchecked","continuity":{"breaks":0},"replay_determinism":"unchecked","determinism_details":"Recorded playback only; execution transitions are not recomputed.","protocol":"LTP/0.1","node":"ltp-rust-node@0.1.0","signatures":{"present":true,"valid":null,"verification":"unchecked","key_ids":["key-1"],"algorithm":"ed25519"}},"audit_summary":{"verdict":"INCOMPLETE","risk_level":"LOW","failed_checks":[],"violations":[],"violations_count_by_severity":{"CRITICAL":0,"HIGH":0,"MODERATE":0,"LOW":0},"unchecked_checks":["replay_determinism","signature_verification","identity_authentication","regulatory_readiness"],"regulator_ready":false}}
